{
  "schema_version": "1.0.0",
  "tool_versions": {
    "ffprobe": "SET_TO_INSTALLED_FFPROBE_VERSION",
    "ffmpeg": "SET_TO_INSTALLED_FFMPEG_VERSION"
  },
  "expected_duration_seconds": 30.0,
  "duration_tolerance_seconds": 0.5,
  "subtitle_min_coverage": 0.75,
  "audio_peak_dbfs_max": -1.0,
  "specification": {
    "width": 1920,
    "height": 1080,
    "frame_rate": 30,
    "container": "mp4",
    "video_codec": "h264",
    "audio_codec": "aac"
  },
  "required_subtitle": true,
  "required_audio": true,
  "frame_rate_tolerance": 0.02
}
